"sep=,",,,,,
Improving user experience with Apple Pencil,2018-06-07,2018-06-07,09:00 - 09:45,Room 2,"<div class=""schedule__speaker""><img src=""http://altconf.com/wp-content/uploads/2018/05/Hill.png"" />Douglas Hill</div><br>Apple Pencil unlocks a different way to interact with iPad, which can be both efficient and comfortable. I’ve implemented enhanced support for Apple Pencil in our product and would like to share what I learned.

This would be most beneficial to anyone making an iPad app that supports drawing. However I think Apple Pencil could enhance other kinds of apps too, and the topic is generally interesting.

The talk would cover both design and implementation. I would discuss:

• The benefits of Apple Pencil for users and what features it works well for.
• How to detect the Pencil and distinguish it from finger touches.
• How to increase realism and responsiveness using coalesced and predicted touches.
• Performance. While this is highly dependent on your codebase, I can share some general tips for using Instruments to identify bottlenecks and some possible ways to make your code faster."
Core Data with Confidence,2018-06-07,2018-06-07,10:00 - 10:45,Room 1,"<div class=""schedule__speaker""><img src=""http://altconf.com/wp-content/uploads/2018/05/Rotondo.png"" />Kate Rotondo</div><br>Core Data is a robust iOS persistence solution. So why does it strike fear in the heart of new developers? Together, let's demystify the components of the Core Data stack: the data model, one or more managed object contexts, the persistent store coordinator, and the persistent container. We’ll bring each class to life, exploring its unique role, and how all of the classes work together as a system to save and load data on the device. Then we’ll peek through the doors that open once you understand these basics, including updating your UI in response to data changes, migrating data versions, and backgrounding long data tasks. You’ll leave with a really clear mental model of what Core Data offers, and the confidence to add it to your projects."
"Firebase is a database, right?",2018-06-07,2018-06-07,10:00 - 10:45,Room 2,"<div class=""schedule__speaker""><img src=""http://altconf.com/wp-content/uploads/2018/05/Person.png"" />Jen Person</div><br>Firebase is best known for its Realtime Database offering, but there’s so much more to it! It’s a whole suite of tools to help you build your app and grow your user base on mobile. Come learn about Firebase offerings that make app development quick and scalable. See some of the features of Firebase like MLKit, Cloud Firestore, Cloud Storage, Dynamic Links, and Auth. If you’re already familiar with Firebase, this is for you, too! We’re going to dive into some code and talk practices for managing asynchronous data from Firebase.
"
Scalable iOS Applications with Serverless and Kubernetes,2018-06-07,2018-06-07,11:00 - 11:45,Room 1,"<div class=""schedule__speaker""><img src=""http://altconf.com/wp-content/uploads/2018/05/blank.png"" />Jennie Oliver & Andy Trice</div><br>Learn about popular application development trends that companies are following to disrupt their industries. We'll walk through how to build a scalable iOS app that could run on Serverless or Kubernetes using DevOps best practices."
The importance of Privacy in iOS,2018-06-07,2018-06-07,11:00 - 11:45,Room 2,"<div class=""schedule__speaker""><img src=""http://altconf.com/wp-content/uploads/2018/05/molina.png"" />Manuel Carrasco-Molina</div><br>A lot of time Privacy of my data as a user is not a priority for Developers. Wether it's my calendar, my contacts, my location, I want as a user to be able to use an app without all of those attacks in my privacy. I want to summarise everything an iOS developer should do to ensure the most critical user can still use my app in some regards, and not just say ""I need all your information"" like on other platforms. This is the beauty of iOS, being able to fine grained (although not enough) so let's do this all together, as a beautiful community concerned by Privacy. "
Millions of customers. Billions of dollars. Real-world iOS Architecture at Scale.,2018-06-07,2018-06-07,13:00 - 13:45,Room 1,"<div class=""schedule__speaker""><img src=""http://altconf.com/wp-content/uploads/2018/05/Kaler.png"" />Parveen Kaler</div><br>The architecture for the Item Page in Walmart's iOS App has evolved from 50,000 lines of Objective-C sitting on top of a REST API implemented as a UITableView to much less Swift code sitting on top of a GraphQL API implemented as a UICollectionView.

We will talk about the evolutionary process.  We will talk about lessons learned over the years.  The pros/cons of different architecture decisions."
HomeKit Hidden Opportunities For Developers,2018-06-07,2018-06-07,13:00 - 13:45,Room 2,"<div class=""schedule__speaker""><img src=""http://altconf.com/wp-content/uploads/2018/05/Spivack.png"" />Robert Spivack</div><br>HomeKit is Apple's official foray into Smart Home automation systems.  HomeKit brings modern user interface and user experience paradigms to the stodgy world of traditional overpriced and proprietary control solutions costing up to $100,000 or more.

While off to a good start, HomeKit has many limitations which has made it an easy target of ridicule by old school professional systems integrators.

A few innovative integrators are swimming upstream selling and installing systems based on HomeKit but face many obstacles trying to match the capability of existing competitors.  This talk by a systems integrator “in the trenches” will present a summary of the current limitations encountered with HomeKit highlighting the opportunities for indie developers to help bridge the gap.

The focus is on presenting product ideas for embracing and extending HomeKit with profitable complementary software apps and services to solve these limitations.

Home automation is a vertical market that is currently undergoing explosive growth and Apple HomeKit has the potential to become a dominant solution.  Developers with the right skills and interest can find  interesting product and revenue opportunities that most are overlooking.

The market demand is there, the products are not (yet)."
Going Open Source: Advantages and Lessons Learned,2018-06-07,2018-06-07,14:00 - 14:45,Room 1,"<div class=""schedule__speaker""><img src=""http://altconf.com/wp-content/uploads/2018/05/Cardoso.png"" />Matheus Cardoso</div><br>What does Open Source mean for iOS developers today? What are the """"dos and don'ts"""" of maintaining an Open Source project? How does it fit in a viable business model and is there an actual advantage?

In this talk I'll share my experience maintaining the iOS version of Rocket.Chat - an Open Source communication platform with daily contributions from all around the globe."
Dates and Time By Example,2018-06-07,2018-06-07,14:00 - 14:45,Room 2,"<div class=""schedule__speaker""><img src=""http://altconf.com/wp-content/uploads/2018/05/Kelley.png"" />Jeff Kelley</div><br>Have you ever had a bug that dealt with dates and times? Dealing with time zones, Daylight Saving Time, and the like can make the hair on the back of even the most experienced developer's neck stand up. We all know how to tell time and how calendars work, and yet these bugs are terrifying. Why? Using Swift as a lens to walk through common problems, we’ll explore writing date and time code that’s correct and easy to understand. You’ll leave with an approach to solving calendrical calculations without fear, new tools for handling these problems in your code, and a huge appreciation for the people behind the libraries that make this possible."
WWDC 2018 Week In Review,2018-06-07,2018-06-07,15:00 - 15:45,Room 1,"<div class=""schedule__speaker""><img src=""http://altconf.com/wp-content/uploads/2018/05/Dempsey.png"" />James Dempsey</div><br/>
Join James Dempsey for his fifth annual Week In Review, a lighthearted look back at the announcements of WWDC 2018. Close out AltConf in style with a session that combines easy-going humor, music, and perspective from a fifteen year Apple veteran gone indie. And as usual, there will be a bit involving a ukulele.
"
Implementing a New Diagnostic Tool for Slack Notifications ,2018-06-05,2018-06-05,16:00 - 16:45,Room 1,"<div class=""schedule__speaker""><img src=""http://altconf.com/wp-content/uploads/2018/05/Thomas.png"" />Kaya Thomas</div><br>Notifications are an essential part of using messaging apps. If you use an app like Slack for work, not receiving notifications can have serious consequences. At Slack, we created a diagnostic tool so that users can have better context to how their notifications work. The tool checks their device settings, Slack specific settings, push token and sends a test notification if possible. With the tool we give the user actionable steps to fix anything that could potentially keep them from receiving notifications. I worked as the iOS engineer on this project and in this talk I want to explain why a diagnostic tool like this can be a game changer for apps that depend on notifications and how I implemented the tool using reactive programming. As a takeaway, the audience should have an understanding on how creating diagnostic tools can help empower their users to have better understanding of their settings as well as how to use reactive programming to cleanly implement such a tool."
Improving Application Startup Performance,2018-06-05,2018-06-05,16:00 - 16:45,Room 2,"<div class=""schedule__speaker""><img src=""http://altconf.com/wp-content/uploads/2018/05/Ackerson.png"" />Ken Ackerson</div><br>For the last year at Tumblr we have been extensively working on improving our application's start up time. Learn about many different aspects of optimizing your application's startup time as well as some interesting things we have learned along the way."
Gotta Go Fast,2018-06-06,2018-06-06,16:00 - 16:45,Room 1,"<div class=""schedule__speaker""><img src=""http://altconf.com/wp-content/uploads/2018/05/Parham.png"" />Luke Parham</div><br>If you've been working on an iOS app for a while, you may have noticed that over time your once snappy app has started to feel a little sluggish. Your feed limps along with the occasional stall or maybe you're trying to build a camera app but it seems to lag quite a bit behind reality.  Contrary to popular opinion, our software is becoming increasingly demanding at a rate that easily exceeds how quickly our devices are improving.

The talk explains how to track overall performance, find performance problems and how to fix a few big ones. Sprinkled throughout are 10 Rules for Good Performance."
"Implement Apple’s “Security at Its Core” Approach in Your Apps Across iOS, Android, Web and the Cloud",2018-06-05,2018-06-05,10:00 - 10:45,Room 2,"<div class=""schedule__speaker""><img src=""http://altconf.com/wp-content/uploads/2018/05/Szabo.png"" />David Szabo</div><br>Apple is famous for building security into the core of every Apple product: secure auth, user device management via iCloud-hosted keychains, End-to-End Encrypted iMessage and more. But what happens when your apps run on Android, in browsers and in the cloud where you can’t take Apple’s security with you? David Szabo of Virgil Security, the company behind Twilio’s End-to-End Encrypted Messaging, will walk us through how companies like WhatsApp and Apple implemented cross-platform security and how you too can turn on these features with simple, open source building blocks to make privacy a feature and not a bug in your product. If you miss this talk, follow Virgil’s World Tour across AltConf, DeveloperWeek in NYC, Webit in Sofia, online webinars, technical workshops and more: https://virgilsecurity.com/worldtour
"
10 years of app marketing failures with occasional successes,2018-06-06,2018-06-06,16:00 - 16:45,Room 2,"<div class=""schedule__speaker""><img src=""http://altconf.com/wp-content/uploads/2018/05/michaels.png"" />Josh Michaels</div><br>As the App Store approaches the 10 year mark one topic that deserves full review is marketing. From the early days of the App Store to today the techniques for marketing apps have changed dramatically. As in all growth markets, attention became harder to get as the size of the market grew. Today techniques that worked just years ago will fail. Understanding the history of marketing in the App Store will help you avoid wasting time using old techniques that no longer work. So if you are thinking of e-mailing or tweeting at a bunch of blog writers to promote your app stop and come to this talk!

In this talk, Josh will review his long string of marketing efforts in support of his independent apps. From ""Ow My Balls!"" to ""Earthlapse"" and ""Magic Fireplace"" Josh has experienced a wide range of successes and failures in which marketing (or the lack of it) played a crucial role. Josh will dispel a variety of myths about app marketing and featuring and provide examples of tactics NOT to use when promoting your app. For winning tactics, you'll have to find another talk. This talk is a must-attend for anyone looking to ship their own apps."
WWDC Keynote Viewing,2018-06-04,2018-06-04,10:00 - 11:45,Room 1,"Join a few hundred of your new best friends and the AltConf team, to view the live stream of the WWDC opening Keynote!"
WWDC Keynote Reaction Panel,2018-06-04,2018-06-04,13:15 - 14:15,Room 1,"After lunch, and before the SOTU live streams, we're bringing together the A-Team of iOS/Mac community members to discuss what was shown in the opening keynote."
Apple SOTU Live stream viewing,2018-06-04,2018-06-04,14:30 - 16:00,Room 1,We'll be live streaming the SOTU talks from WWDC