"sep=,",,,,,
title,startdate,enddate,starttime,location,content
Moving to Subscriptions,2018-06-05,2018-06-05,09:00-09:45,Room 1,"<div class=""schedule__speaker""><img src=""http://altconf.com/wp-content/uploads/2018/05/Owens.png"" />Christian Owens</div><br>Major software products have moved to a subscription business model in the last couple of years - some successfully, some attracting considerable customer backlash.

We've seen many indie Mac developers considering it but unsure how to do it, from figuring out and testing the best pricing and billing models to avoiding backlash to managing the technical aspects of running both one-off customers and recurring subscriptions in parallel.

To help developers considering that approach, I propose a fireside chat where I would moderate a discussion with several leaders of awesome Mac products who have both strong opinions, and real life experience in that tricky move. Some of them our customers, some of them friends of us - all of them with really interesting, and often different views on the topic.

We are currently discussing WWDC presence with them, so here's an indicative list of the key developers with whom I'd run the session (3-4 of them will join):
- Opposed to subscriptions: RogueAmoeba or Panic
- Enthusiastic on subscriptions: Framer, Ulysses or Tower
- Offering a 3rd, in-between approach: Sketch, Smile Software or Setapp

The session will focus on practical examples of what went well and what went horribly wrong, to make it very actionable for the audience - no fluff, sales pitch or vague ideas, just concrete learnings, both from a technical and a business standpoints."
Building Apps for Everyone,2018-06-05,2018-06-05,09:00-09:45,Room 2,"<div class=""schedule__speaker""><img src=""http://altconf.com/wp-content/uploads/2018/05/Devesa.png"" />Daniel Devesa Derksen-Staats</div><br>It is the moment you have been working so hard for. You press the ‘Submit’ button. Your app is now on its way to the App Store. In just a few days, your app is going to be available globally. But… is it really?

Any developer of an app with an aim of reaching a global audience needs to localise the app (most of us do that), but also to make it accessible! In this talk we will try to provide a few techniques for improving those two areas of your apps from the points of view of the code, the use of tools we have available and the users’ expected experience.

A series of examples will be presented, showing how some of your users may perceive your app when localisation and accessibility are not correctly implemented or not implemented at all.

You would freak out if the ‘Back’ button was on the right side of the navigation bar, but that is what users that speak right-to-left written languages expect. If a modal view was presented without a ‘Close/Done’ button, you would consider it a bug, but it may exactly be what you are giving to blind users.

Smartphones, apps and the whole Apple ecosystem has helped us develop much more inclusive apps that anyone can use. But we can do better by building apps for everyone."
A Pre-Success Story,2018-06-05,2018-06-05,10:00 - 10:45,Room 1,"<div class=""schedule__speaker""><img src=""http://altconf.com/wp-content/uploads/2018/05/Hixon.png"" />Dan Hixon</div><br>We have all heard and been inspired by success stories. Tales of success are great! From Apollo XI to Falcon Heavy, the original Macintosh to the iPhone– it’s so satisfying when the odds seem against us and yet we prevail. The problem with success stories is that they are only told by the people who have succeeded. This is called survivorship bias. [https://www.xkcd.com/1827/] “Never stop buying lottery tickets…”

 I’ve been self-employed for two and a half years trying to make a living in the App Store. My goal is to be earning enough money to provide for my family. I’m not there yet but I have made money. I have also checked items off my bucket list because l've been trying to achieve this goal. I want to share my story precisely because it isn’t a bona-fide success story yet. I hope I can inspire you with it–I hope my talk will help you try something you’ve been wanting to try.

-=-=-=-=-=-=-=-=-=-=-=-

I will tell stories of my business. My business partner and I travel to remote and beautiful places to capture aerial videos for our relaxation and meditation app. To make an omelet you must break eggs; We’ve crashed about $10k worth of quadcopters. I'll tell 4 drone crash stories - how they shaped our business and attitudes about failure. I'll tell the story of us attending WWDC and Alt-Conf last year while sleeping in our car.

I’ll talk about our marketing efforts, pricing strategies, etc.  The difficulty we have, as artists, to promote ourselves and our product.  The necessity of living on a tight budget has been a mother of invention for me. Resulting in new skills, personality traits, and possibilities. "
How to train your own model for CoreML,2018-06-05,2018-06-05,11:00 - 11:45,Room 1,"<div class=""schedule__speaker""><img src=""http://altconf.com/wp-content/uploads/2018/05/Shirazian.png"" />Reza Shirazian</div><br>The talk will be a quicker version of this article I wrote back in July https://reza.codes/2017-07-29/how-to-train-your-own-dataset-for-coreml/ "
9 Lessons Learned from Scaling a New App Business to $1M Recurring Revenue in 6 Months,2018-06-05,2018-06-05,11:00 - 11:45,Room 2,"<div class=""schedule__speaker""><img src=""http://altconf.com/wp-content/uploads/2018/05/Stepanenko.png"" />Yaroslav Stepanenko</div><br>To go from a standing start to over $1 million in 6 months is, as the majority in the app development community would agree, a positive sign that we’re offering an app service that customers around the world want. 
Achieving this sort of growth in a relatively short period of time - only 6 months - is challenging. We have learned A LOT from this journey, so we wanted to share with you 9 of the most valuable lessons:

Lesson 1: Make a Product Launch EXCLUSIVE
Lesson 2: Work with Innovators and Early Adopters First, every time. No exceptions
Lesson 3: Build a community before aiming for revenue
Lesson 4: Winning new customers is only half the battle
Lesson 5: Not all metrics carry the same importance
Lesson 6: Create a referral program
Lesson 7: Decide when to go global
Lesson 8: Segment packages around customer needs
Lesson 9: Plan and deploy resources and teams effectively. Increase collaborative opportunities"
Being technical on how to clean tech debt,2018-06-05,2018-06-05,13:00 - 13:10,Room 1,"<div class=""schedule__speaker""><img src=""http://altconf.com/wp-content/uploads/2018/05/Cerdeiral.png"" />Fabio Cerdeiral</div><br>Quick talk on how to tackle technical debt in your team. Here I'd reference several articles I've had on how to classify your tech debt and prioritize it accordingly. Things you should tackle as soon as possible to avoid spreading if it's easily dependent and buried deep inside the system and some other things you should just set as lower priority because it's contained and the impact on the user experience is minimal."
Because not everyone speaks English...,2018-06-05,2018-06-05,13:15 - 13:25,Room 1,"<div class=""schedule__speaker""><img src=""http://altconf.com/wp-content/uploads/2018/05/Easton.png"" />Ben Easton</div><br>There are thousands of languages in the world and yet we can easily get lost in just creating for an English audience. Based on my experience adding multiple languages to the Coffee Meets Bagel iOS app I will discuss some of the challenges in creating a localizable app. 
The following will be included:
• How NSLocalizedString works
• Why string concatenation is so deadly
• String dictionary files
• How to deal with plurals and genders.
• General things to avoid and keep in mind when designing for internationalization."
Creating macOS Build Infrastructure in the Cloud with MacStadium,2018-06-05,2018-06-05,13:30 - 13:45,Room 1,"<div class=""schedule__speaker""><img src=""http://altconf.com/wp-content/uploads/2018/05/Lankton.png"" />Shawn Lankton</div><br>iOS and macOS app development can be challenging since builds have to run on Genuine Apple Mac infrastructure. More companies than you might think end up with Mac minis piled up in a closet, but they quickly run into challenges with security and scalability. In this session, learn how MacStadium deploys Mac hardware, SAN storage, and virtualization technology to create robust, scalable clouds perfect for iOS/macOS development, testing, and continuous integration."
I hate public speaking. So why do I keep doing it?,2018-06-05,2018-06-05,13:00 - 13:10,Room 2,"<div class=""schedule__speaker""><img src=""http://altconf.com/wp-content/uploads/2018/05/Diaz.png"" />Francisco Diaz</div><br>Last year, after a talk I gave in my hometown someone asked me """"Why do you give talks?"""" I couldn't answer honestly.

The first reaction I get when I hear public speaking is panic. Every time I need to jump on stage I feel that cold sweat running down the back of my neck.

Why do I keep doing it if it’s so uncomfortable?

In this talk, I’ll not only try to answer that question but also tackle some of the most common misunderstandings surrounding tech talks. Is the speaker the most technically capable? Do they have a special knowledge about the topic they’re discussing?

The best professionals I’ve worked with in my career have been great communicators. As with any skill, this needs to be trained. I'll argue that public speaking is a great way to improve our communication skills and to get out of our comfort zone."
"ARKit+SceneKit tips and tricks
Microsoft",2018-06-05,2018-06-05,13:15 - 13:25,Room 2,"<div class=""schedule__speaker""><img src=""http://altconf.com/wp-content/uploads/2018/05/Mazariegos.png"" />Erwin Mazariegos</div><br>I am currently building a client app with an AR mode. This is my first production app using SceneKit, and I am learning a lot. I also find it a bit frustrating, but am figuring out various tricks to help with debugging, and I am settling in on some practices that help the development process. 

I am working with basic primitive shapes: rectangles, cylinders, spheres, extruded text, and spotlights, directly in code and using the SceneKit Editor. I am animating objects, morphing shapes, and playing video (including in a Harry-Potter-esque short loop preview). "
Open Slot,2018-06-05,2018-06-05,13:30 - 13:45,Room 2,"<div class=""schedule__speaker""><img src=""http://altconf.com/wp-content/uploads/2018/05/"" />Speaker</div><br>TBD"
Augmented Reality Beyond ARKit,2018-06-05,2018-06-05,14:00 - 14:45,Room 1,"<div class=""schedule__speaker""><img src=""http://altconf.com/wp-content/uploads/2018/05/Gallagher.png"" />Alexis Gallagher</div><br>ARKit has given iOS devices magical new powers but even this magic has limits — limits based on hardware requirements and on API precision. This session will describe how, at the startup where I work in SF, we use a variety of familiar iOS frameworks, as well as some of our own machine learning models, in order to build an augmented reality experience that goes beyond ARKit. Our app provides an AR view of the user wearing custom glasses -- but without using an iPhone X, and of a higher precision than what the iPhone X provides. If you're wondering what you can do with ARKit out of the box, and what it takes to build powerful experiences without it, come to this talk."
How to not fail on the App Store,2018-06-05,2018-06-05,14:00 - 14:45,Room 2,"<div class=""schedule__speaker""><img src=""http://altconf.com/wp-content/uploads/2018/05/Michaeli.png"" />Ariel Michaeli</div><br>Making a great app is hard, but making a successful app is even harder if you only think about the technical. As the founder of an app analytics company I've learned many lessons about building app companies, which I will share in this fun and energetic talk."
Bootstrapping the Machine Learning Training Process,2018-06-05,2018-06-05,15:00 - 15:45,Room 1,"<div class=""schedule__speaker""><img src=""http://altconf.com/wp-content/uploads/2018/05/Kane.png"" />Meghan Kane</div><br>When is it valuable to consider using machine learning to help solve your iOS app’s problems? We will go through criteria to evaluate that, practical use cases of incorporating ML models on device, and how to bootstrap the training process for creating machine learning models that will run on device (iOS). You may think that lots of data, compute power, time, and expertise are necessary to train custom models; however, this is not the case! Using techniques such as transfer learning and taking inspiration from the plentiful resources from industry and academia, you can get started doing this now. 

In this talk, we will go through training custom machine learning models using Tensor Flow across different domains (image classification, audio classification, & more). And, yes, we will move beyond the dog / cat classifier.

Additionally, we will cover the state of ML for iOS: what has been available since iOS 11 (Core ML, Vision, etc), announcements from WWDC 2018, and Swift for Tensor Flow."
FullStack Swift from Prototype to Production in 3 Months - the Ask Mercedes Story,2018-06-05,2018-06-05,15:00 - 15:45,Room 2,"<div class=""schedule__speaker""><img src=""http://altconf.com/wp-content/uploads/2018/05/Bailey.png"" />Chris Bailey</div><br>Swift on the server arrived with the promise the to enable Swift developers to become """"Fullstack"""", building end-to-end Swift applications. It also promised to enable higher levels of productivity through the reused of code, as well as greater safety and less bugs through the reuse of the data types. Two years on, has Swift on the server delivered on that promise?

In this session, Marco Gloria from Mercedes Benz will describe how his team built the Ask Mercedes application, which went from prototype to production using Kitura in just three months, describing both the challenges and successes he had. Additionally, Chris Bailey from the Kitura team will describe how the server side Swift ecosystem is continuing to advance, and what new capabilities are arriving to make it even easier to build production applications."
Storming the Castle: Why Do Your Users Hate You And What Can You Do About It?,2018-06-06,2018-06-06,09:00 - 09:45,Room 1,"<div class=""schedule__speaker""><img src=""http://altconf.com/wp-content/uploads/2018/05/Lewis.png"" />Shaun Lewis</div><br>This is a fast-moving, but entertaining talk that has some horror stories to drive home the point that users shouldn't have to use the App Store review text box or a random support email as the only places they can contact you. I show how O'Reilly Media uses in-app feedback within the app to listen to users and provide a pressure relief valve for their frustrations.

I also talk about why it's important for developers to talk directly to customers and how we have empowered our mobile devs to engage with their users and to listen to their feedback in a way that helps drive product development."
Shared or Mutable: Pick One,2018-06-06,2018-06-06,09:00 - 09:45,Room 2,"<div class=""schedule__speaker""><img src=""http://altconf.com/wp-content/uploads/2018/05/Heo.png"" />Greg Heo</div><br>Having shared mutable state is often the default for our applications: a view with a lot of properties that gets passed around, or an app delegate accessible from everywhere that holds state. Shared mutable state can be the source of many headaches — it makes it difficult to trace through your programs, and hard to reason about concurrency.

In this session, we'll look at examples of *why* this is the case and two ways of *how* to fix it: 1) use shared but immutable state; or 2) mutable but unshared state. Between shared and mutable, you should pick just one and by the end of this talk you'll know how to make that choice."
A Tour of the Photo Capture Pipeline,2018-06-06,2018-06-06,10:00 - 10:45,Room 1,"<div class=""schedule__speaker""><img src=""http://altconf.com/wp-content/uploads/2018/05/Sandofsky.png"" />Benjamin Sandofsky</div><br>Whether you're diving into computer vision or building a photo-filter app, it's important to understand the photo capture pipeline. We'll explain debayering, chroma-subsampling, gamma compression, and more. If you've reached the limits of high level APIs and now you're ready to get your hands dirty, this talk is for you."
Rewriting Alamofire: Into the Core,2018-06-06,2018-06-06,10:00 - 10:45,Room 2,"<div class=""schedule__speaker""><img src=""http://altconf.com/wp-content/uploads/2018/05/Shier.png"" />Jon Shier</div><br>Since its first release in 2015, Alamofire has become one of the most popular Swift frameworks. In the three years since that 1.0.0 release, it has gained more and more features, and the internal complexity to go along with them. For version 5, however, we realized it was time to rewrite the core of the library to enable further growth, new features, and greater scalability. In this presentation I will explore the reasoning behind this risky decision and how we were able to use our existing test suite to replace the core of the framework while largely maintaining compatibility for existing Alamofire users."
iOS 12 in 45 minutes,2018-06-06,2018-06-06,11:00 - 11:45,Room 1,"<div class=""schedule__speaker""><img src=""http://altconf.com/wp-content/uploads/2018/05/Hudson.png"" />Paul Hudson</div><br>What better way to explore all the new goodies from Apple than with live coding demonstrations of the most important new features?"
Starting with CloudKit,2018-06-06,2018-06-06,11:00 - 11:45,Room 2,"<div class=""schedule__speaker""><img src=""http://altconf.com/wp-content/uploads/2018/05/Zonneveld.png"" />Jeroen Zonneveld</div><br>CloudKit is introduced in 2014. It's a cloud solution from Apple to easily save and store data to the iCloud database of your app user.

This talk will give an introduction on how to setup CloudKit for your app, what the benefits are and how developers can query and store data to iCloud using CloudKit.

CloudKit is available since iOS 8.0+, macOS 10.10+, tvOS 9.0+ and watchOS 3.0+. 

"
Twilio,2018-06-06,2018-06-06,13:00 - 13:10,Room 1,"<div class=""schedule__speaker""><img src=""http://altconf.com/wp-content/uploads/2018/05/"" />Speaker</div><br>"
Automate Your Life,2018-06-06,2018-06-06,13:15 - 13:25,Room 1,"<div class=""schedule__speaker""><img src=""http://altconf.com/wp-content/uploads/2018/05/Rajpurkar.png"" />Nilofer Rajpurkar</div><br>Keeping up with speedy development is difficult, especially when your process is manual. Automate your life and see how a continuous everything approach can speed up your process and help you provide your users with the most value. Worried about the time and pain in setting this up? Let's journey through painlessly setting up a continuous pipeline for your iOS apps. "
Using data to better understand your users ,2018-06-06,2018-06-06,13:30 - 13:45,Room 1,"<div class=""schedule__speaker""><img src=""http://altconf.com/wp-content/uploads/2018/05/Fu.png"" />Bo-ying Fu</div><br>You've shipped an app, and the reviews are coming in. People generally seem to like your app but now what? How do you make decisions on what to do next? Are your users using the features as intended? What is success? Telemetry is the way to get broad answers s without needing to interview all of your users. It’s important to know the difference between what you think your user are doing vs what they are actually doing. Ask questions and answer with real data to drive effective decisions in your development process. "
The freedom of expressions,2018-06-06,2018-06-06,13:00 - 13:10,Room 2,"<div class=""schedule__speaker""><img src=""http://altconf.com/wp-content/uploads/2018/05/Nguyen.png"" />Minh Nguyen</div><br>The Mapbox Maps SDK for iOS powers high-performance maps based on open data, with an elegant API in Objective-C and Swift. The recent v4.0 release features a renewed emphasis on customizability: you can alter every aspect of the map’s appearance using NSExpression and NSPredicate. We heavily extended NSExpression’s set of first-class functions with a raft of new “aftermarket” functions for common map-related operations. This lightning talk explains the technical details of the Mapbox Maps SDK’s extensions, the API design considerations that led us to this approach, and some of the practical use cases for expressions in maps."
Building Apps with Swift - from Simple to Solution,2018-06-06,2018-06-06,13:15 - 13:25,Room 2,"<div class=""schedule__speaker""><img src=""http://altconf.com/wp-content/uploads/2018/05/Bailey.png"" />Chris Bailey</div><br>Over the course of a short 10 minutes, we will take you on a journey, one in which a simple app grows up. From an early self-contained MVP app, we'll quickly start to enhance it with additional capabilities to add authentication and multi-device support, social sharing, security and even cognitive and machine learning capabilities. What's more, you'll see how all of this can be done using only Swift."
How to prototype and test user experiences quickly,2018-06-06,2018-06-06,13:30 - 13:45,Room 2,"<div class=""schedule__speaker""><img src=""http://altconf.com/wp-content/uploads/2018/05/Mellin.png"" />Joe Mellin</div><br>Look at how to learn what to build as quickly as possible. See how you can leverage different tools from paper prototyping, to click through mockups, leverage usertesting.com and receive qualitative feedback to shape your decision making and drive development process to create better user experiences. "
Machine Learning on iOS: Integrating IBM Watson with Core ML,2018-06-06,2018-06-06,14:00 - 14:45,Room 1,"<div class=""schedule__speaker""><img src=""http://altconf.com/wp-content/uploads/2018/05/Markiewicz.png"" />Tom Markiewicz</div><br>Apple recently announced a partnership with IBM to integrate Core ML with Watson, allowing visual recognition to run locally on iOS devices. The ability to use machine learning while offline opens up a wide range of applications and use cases. Geared toward beginners (both in Swift and machine learning), this session will focus on providing an overview of machine learning and Core ML, how to implement IBM Watson with Core ML, and techniques for continuous learning and model training. Additionally, we’ll cover the benefits of using machine learning locally and what’s in store for the future."
"Swift, for Objective-C OG's",2018-06-06,2018-06-06,14:00 - 14:45,Room 2,"<div class=""schedule__speaker""><img src=""http://altconf.com/wp-content/uploads/2018/05/James.png"" />Timirah James</div><br>At just four years old, Swift is quickly becoming even more popular than it’s thirty-three year old predecessor, Objective-C. Experience in Swift is becoming more desirable and in demand in the iOS force as companies both old and new transition and migrate their code for the new Swift takeover. In this talk, I’ll be giving an “Objective-C OG” style intro to the Swift language (for those who have experience in the Obj-C language).

Some of the things we’ll be covering in this talk will include:

Swift vs. Objective-C syntax comparison
The evolution of Swift
The future of Swift
The future of Objective-C

By the end of this talk, attendees will have gained a basic understanding of the concept of the Swift language in comparison to Objective-C, as well as the knowledge and resources to continue exploring and building their skills in Swift."
"Mac Developer Survey Results by MacPaw: app distribution channels, challenges developers face and the solutions they find, and much more.",2018-06-06,2018-06-06,15:00 - 15:45,Room 1,"<div class=""schedule__speaker""><img src=""http://altconf.com/wp-content/uploads/2018/05/Stepanenko.png"" />Yaroslav Stepanenko</div><br>700+ developers responded to an annual survey and shared their thoughts on the Mac App Store and the state of Mac app development. Come and see what the market is now compared to a year ago, and what’s coming.

Here is last year’s report: https://setapp.com/mac-market-survey-2017, that was announced at AltConf 2017 (https://academy.realm.io/posts/altconf-2017-yaroslav-stepanenko-macpaw-mac-developers-survey-results/)

This year it will be once again exclusively announced at AltConf 2018."
The Secret Life of a Digital Nomad: The New Normal,2018-06-06,2018-06-06,15:00 - 15:45,Room 2,"<div class=""schedule__speaker""><img src=""http://altconf.com/wp-content/uploads/2018/05/Murashev.png"" />Natasha Murashev</div><br>I've been a digital nomad for three years now. Although it started out bumpy, it is now my new normal. Learn how choosing a digital nomad lifestyle will change your life in ways you haven't imagined, including how you handle money, how you make friends, and the unforeseen choices you get to make every single day. "
Building An App Company - It's More Than Code,2018-06-07,2018-06-07,09:00 - 09:45,Room 1,"<div class=""schedule__speaker""><img src=""http://altconf.com/wp-content/uploads/2018/05/Sacks.png"" />Michael Sacks</div><br>This talk is designed for the engineer who wants to try entrepreneurship. I believe that there are many iOS devs who have worked for other people their whole careers, but want to try to go at it on their own. My talk is designed to teach iOS developers about the differences and similarities between iOS development and entrepreneurship. I'd like to help iOS devs make their risk taking more calculated."
